1,journals/tosem/DillonKMMR94,A Graphical Interval Logic for Specifying Concurrent Systems.,Laura K. Dillon   G. Kutty   Louise E. Moser   P. M. Melliar-Smith   Y. S. Ramakrishna   ,1994
2,journals/cacm/FurnasLGD87,The Vocabulary Problem in Human-System Communication.,George W. Furnas   Thomas K. Landauer   Louis M. Gomez   Susan T. Dumais   ,1987
3,journals/coling/HirschbergL94,Empirical Studies on the Disambiguation of Cue Phrases.,Julia Hirschberg   Diane J. Litman   ,1993
4,journals/eswa/ChenWL11,A general knowledge mediation infrastructure for multi-agent systems.,Kun Chen   Huaiqing Wang   Hokyin Lai   ,2011
5,conf/dlog/KaminskiS09,Terminating Tableaux for SOQ with Number Restrictions on Transitive Roles.,Mark Kaminski   Gert Smolka   ,2009
6,conf/cg/Cazenave00,Abstract Proof Search.,Tristan Cazenave   ,2000
7,conf/ilp/DomingosKLPRS08,Markov Logic.,Pedro Domingos   Stanley Kok   Daniel Lowd   Hoifung Poon   Matthew Richardson   Parag Singla   ,2008
8,conf/ijcai/DaiMW09,Domain-Independent Automatic Partitioning for Probabilistic Planning.,Peng Dai   Mausam   Daniel S. Weld   ,2009
9,conf/aaai/DaiMW10,Decision-Theoretic Control of Crowd-Sourced Workflows.,Peng Dai   Mausam   Daniel S. Weld   ,2010
10,journals/tsp/SherlockM98,On the space of orthonormal wavelets.,Barry G. Sherlock   Donald M. Monro   ,1998
11,conf/pg/BajajIP99,Making 3D Textures Practical.,Chandrajit L. Bajaj   Insung Ihm   Sanghun Park   ,1999
12,conf/wise/TorloneA01,A Unified Framework for Data Translation over the Web.,Riccardo Torlone   Paolo Atzeni   ,2001
13,conf/sc/CrawfisMBC93,Volume rendering of 3D scalar and vector fields at LLNL.,Roger Crawfis   Nelson L. Max   Barry G. Becker   Brian Cabral   ,1993
14,conf/uai/WellmanL94,State-Space Abstraction for Anytime Evaluation of Probabilistic Networks.,Michael P. Wellman   Chao-Lin Liu   ,1994
15,journals/bc/FahleP91,Perceptual rivalry between illusory and real contours.,Manfred Fahle   G uuml,
16,conf/dagm/DenglerS90,The Pseudo-Logarithmic Transformation for Robust Displacement Estimation.,Joachim Dengler   Markus Schmidt   ,1990
17,conf/dagm/UlgesB08,A Local Discriminative Model for Background Subtraction.,Adrian Ulges   Thomas M. Breuel   ,2008
18,journals/pami/KulisJG09,Fast Similarity Search for Learned Metrics.,Brian Kulis   Prateek Jain   Kristen Grauman   ,2009
19,journals/heuristics/MitoF04,On Heuristics for Solving Winner Determination Problem in Combinatorial Auctions.,Masaya Mito   Satoshi Fujita   ,2004
20,conf/ausai/LimT05,A Lagrangian Heuristic for Winner Determination Problem in Combinatorial Auctions.,Andrew Lim   Jiqing Tang   ,2005
21,conf/iat/MitoF03,On Heuristics for Solving Winner Determination Problem in Combinatorial Auctions.,Masaya Mito   Satoshi Fujita   ,2003
22,conf/isaac/BachooreB07,Weighted Treewidth Algorithmic Techniques and Results.,Emgad H. Bachoore   Hans L. Bodlaender   ,2007
23,conf/amfg/TianBCPHSB03,Absolute Head Pose Estimation From Overhead Wide-Angle Cameras.,Ying-li Tian   Lisa M. G. Brown   Jonathan H. Connell   Sharath Pankanti   Arun Hampapur   Andrew W. Senior   Ruud M. Bolle   ,2003
24,conf/iscas/MaharatnaTKGJ04,A CORDIC like processor for computation of arctangent and absolute magnitude of a vector.,Koushik Maharatna   Alfonso Troya   Milos Krstic   Eckhard Grass   Ulrich Jagdhold   ,2004
25,journals/vc/ThalmannRMR85,A model for the three-dimensional reconstruction and animation of the human heart.,Daniel Thalmann   O. Ratib   Nadia Magnenat-Thalmann   A. Righetti   ,1985
26,conf/hpcn/ChiccoliPSZ01,Monte Carlo Simulations of a Biaxial Liquid Crystal Model Using the Condor Processing System.,C. Chiccoli   P. Pasini   F. Semeria   C. Zannoni   ,2001
27,journals/tcad/SalehN89,The exploitation of latency and multirate behavior using nonlinear relaxation for circuit simulation.,Resve A. Saleh   A. Richard Newton   ,1989
28,journals/computer/NarasimhanMM99,Using Interceptors to Enhance CORBA.,Priya Narasimhan   Louise E. Moser   P. M. Melliar-Smith   ,1999
29,conf/compsac/MoserMT02,Online Upgrades Become Standard.,Louise E. Moser   P. M. Melliar-Smith   L. A. Tewksbury   ,2002
30,conf/compsac/ZhaoMM02,On Bootstrapping Replicated CORBA Applications.,Wenbing Zhao   Louise E. Moser   P. M. Melliar-Smith   ,2002
31,conf/csfw/Melliar-SmithM91,Protection against Covert Storage and Timing Channels.,P. M. Melliar-Smith   Louise E. Moser   ,1991
32,conf/icdcs/ChenMM96,Reservation-Based Totally Ordered Multicasting.,Xiaomin Chen   Louise E. Moser   P. M. Melliar-Smith   ,1996
33,conf/acm/ValerioMMS94,The QuickRing Network.,Marcos Valerio   Louise E. Moser   P. M. Melliar-Smith   Paul Sweazey   ,1994
34,conf/acm/MoserM93,Analysis of Timing Hazards in Ada Programs.,Louise E. Moser   P. M. Melliar-Smith   ,1993
35,conf/oodbs/MossS88,Managing Persistent Data with Mneme Designing a Reliable Shared Object Interface.,J. Eliot B. Moss   Steven Sinofsky   ,1988
36,journals/scp/ChungS07,Bridging the gap between enterprise architectures and software architectures.,Lawrence Chung   Nary Subramanian   ,2007
37,journals/eccc/ECCC-TR94-012,Bounds for the Computational Power and Learning Complexity of Analog Neural Nets,Wolfgang Maass   ,1994
38,journals/siamcomp/Maass97,Bounds for the Computational Power and Learning Complexity of Analog Neural Nets.,Wolfgang Maass   ,1997
39,conf/colt/Maass91,On-Line Learning with an Oblivious Environment and the Power of Randomization.,Wolfgang Maass   ,1991
40,conf/stoc/Maass93,Bounds for the computational power and learning complexity of analog neural nets.,Wolfgang Maass   ,1993
41,conf/aaai/LevesqueCN90,On Acting Together.,Hector J. Levesque   Philip R. Cohen   Jos eacute,
42,conf/icip/BylundAK05,Interactive 3D filter design for ultrasound artifact reduction.,Nina Eriksson Bylund   Mats T. Andersson   Hans Knutsson   ,2005
43,journals/tods/AgrawalCL87,Concurrency Control Performance Modeling Alternatives and Implications.,Rakesh Agrawal   Michael J. Carey   Miron Livny   ,1987
44,journals/software/ShrivastavaDP91,An Overview of the Arjuna Distributed Programming System.,Santosh K. Shrivastava   Graeme N. Dixon   Graham D. Parrington   ,1991
45,conf/agents/PappachanD01,A satisficing multiagent plan coordinating algorithm for dynamic domains.,Pradeep M. Pappachan   Edmund H. Durfee   ,2001
46,conf/c++/VlissidesL88,Applying Object-Oriented Design to Structured Graphics.,John M. Vlissides   Mark A. Linton   ,1988
47,journals/sigplan/Skarra89,Concurrency control for cooperating transactions in an object-oriented database.,Andrea H. Skarra   ,1989
48,journals/corr/cs-CY-0304032,Growth in the New Economy U.S. Bandwidth Use and Pricing Across the 1990s,Douglas A. Galbi   ,2003
49,journals/ton/GibbensKT93,Dynamic routing in multiparented networks.,Richard J. Gibbens   Frank P. Kelly   Stephen R. E. Turner   ,1993
50,conf/oopsla/BalK93,Object Distribution in Orca using Compile-Time and Run-Time Techniques.,Henri E. Bal   M. Frans Kaashoek   ,1993
51,journals/tkde/DasguptaNMM99,MAgNET Mobile Agents for Networked Electronic Trading.,Prithviraj Dasgupta   Nitya Narasimhan   Louise E. Moser   P. M. Melliar-Smith   ,1999
52,conf/rtss/MoserM94,Probabilistic Bounds on Message Delivery for the Totem Single-Ring Protocol.,Louise E. Moser   P. M. Melliar-Smith   ,1994
53,conf/icppw/MoserMKB99,A Group Communication Protocol for CORBA.,Louise E. Moser   P. M. Melliar-Smith   Ruppert R. Koch   K. Berket   ,1999
54,conf/sc/WattsSG92,Techniques for Integrating Parallelizing Transformations and Compiler-Based Scheduling Methods.,Tia M. Watts   Mary Lou Soffa   Rajiv Gupta   ,1992
55,conf/focs/ChaudhuriR92,The Complexity of Parallel Prefix Problems on Small Domains,Carsten Lund   Lance Fortnow   Howard J. Karloff   Noam Nisan   ,1992
56,conf/slp/RamakrishnanRSS94,Efficient Incremental Evaluation of Queries with Aggregation.,Raghu Ramakrishnan   Kenneth A. Ross   Divesh Srivastava   S. Sudarshan   ,1994
57,conf/stacs/Bar-YehudaKWZ87,Making Distributed Spanning Tree Algorithms Fault-Resilient.,Reuven Bar-Yehuda   Shay Kutten   Yaron Wolfstahl   Shmuel Zaks   ,1987
58,conf/ecai/Sabah90,CARAMEL A Computational Model of Natural Language Understanding Using a Parallel Implementation.,G eacute,
59,journals/ieicet/TroncosoK06,Trigger-Based Language Model Adaptation for Automatic Transcription of Panel Discussions.,Carlos Troncoso   Tatsuya Kawahara   ,2006
60,conf/awic/Herrera-ViedmaPOHM03,Evaluating the Informative Quality of Web Sites by Fuzzy Computing with Words.,Enrique Herrera-Viedma   Eduardo Peis   Mar iacute,
61,conf/iccv/Grimson88,The Combinatorics Of Object Recognition In Cluttered Environments Using Constrained Search.,W. Eric L. Grimson   ,1988
62,conf/iccv/Grimson88,The Combinatorics Of Object Recognition In Cluttered Environments Using Constrained Search.,W. Eric L. Grimson   ,1988
63,conf/ACMse/FuquayW90,Genetic algorithm solutions for the traveling salesman problem.,D'Ann Fuquay   L. Darrell Whitley   ,1990
64,journals/iee/ShrivastavaW98,Architectural support for dynamic reconfiguration of distributed workflow applications.,Santosh K. Shrivastava   Stuart M. Wheater   ,1998
65,conf/edcc/SinghMM05,Integrating Fault Tolerance and Load Balancing in Distributed Systems Based on CORBA.,A. V. Singh   Louise E. Moser   P. M. Melliar-Smith   ,2005
66,conf/chi/ChalfonteFK91,Expressive richness a comparison of speech and text as media for revision.,Barbara L. Chalfonte   Robert S. Fish   Robert E. Kraut   ,1991
67,journals/aim/HenrionBH91,Decision Analysis and Expert Systems.,Max Henrion   John S. Breese   Eric Horvitz   ,1991
68,conf/rta/Elliott89,Higher-order Unification with Dependent Function Types.,Conal Elliott   ,1989
69,conf/icci/Chen90,Efficient Deterministic Parallel Algorithms for Integer Sorting.,Lin Chen   ,1990
70,conf/ecai/Guez90,A Model for the Automatic Processing of Argumentative Dialogues.,S. Guez   ,1990
71,journals/comcom/TanenbaumKRB91,The Amoeba distributed operating system - A status report.,Andrew S. Tanenbaum   M. Frans Kaashoek   Robbert van Renesse   Henri E. Bal   ,1991
72,conf/interspeech/Carson-BerndsenW01,Defining constraints for multilinear speech processing.,Julie Carson-Berndsen   Michael Walsh   ,2001
73,journals/corr/abs-cs-0612083,A Byzantine Fault Tolerant Distributed Commit Protocol,Wenbing Zhao   ,2006
74,conf/aied/WalkerRK11,Using Automated Dialog Analysis to Assess Peer Tutoring and Trigger Effective Support.,Erin Walker   Nikol Rummel   Kenneth R. Koedinger   ,2011
75,conf/naacl/HaghighiK10,Coreference Resolution in a Modular Entity-Centered Model.,Aria Haghighi   Dan Klein   ,2010
76,conf/acl/PoonD10,Unsupervised Ontology Induction from Text.,Hoifung Poon   Pedro Domingos   ,2010
77,conf/aaai/PoonD07,Joint Inference in Information Extraction.,Hoifung Poon   Pedro Domingos   ,2007
78,journals/is/Eugenio87,Cooperative behaviour in the FIDO system.,Barbara Di Eugenio   ,1987
79,journals/dm/Zeilberger84b,A combinatorial proof of Newton's identities.,Doron Zeilberger   ,1984
80,journals/cn/Ackerley90,The Future for Quality of Service Modelling.,Roger G. Ackerley   ,1990
81,journals/sigpro/Hahn03,On the uniqueness of the definition of the amplitude and phase of the analytic signal.,Stefan L. Hahn   ,2003
82,journals/pami/Lindeberg93,Effective Scale A Natural Unit for Measuring Scale-Space Lifetime.,Tony Lindeberg   ,1993
83,conf/hopl/GriswoldG93,History of the Icon Programming Language.,Ralph E. Griswold   Madge T. Griswold   ,1993
84,journals/pami/KodratoffT88,Learning Based on Conceptual Distance.,Yves Kodratoff   Gheorghe Tecuci   ,1988
85,conf/seke/LiangT95,Apprenticeship Learning of Domain Models.,Yinqing Liang   Gheorghe Tecuci   ,1995
86,journals/stp/Spinellis93,Implementing Haskell Language Implementation as a Tool Building Exercise.,Diomidis Spinellis   ,1993
87,conf/dexa/Spinellis94,The Design and Implementation of a Legal Text Database.,Diomidis Spinellis   ,1994
88,journals/mlq/Kikuchi94,A Note on Boolos' Proof of the Incompleteness Theorem.,Makoto Kikuchi   ,1994
89,conf/uai/Wellman86,Qualitativce probabilistic networks for planning under uncertainty.,Michael P. Wellman   ,1986
90,conf/caap/Schwartzbach90,Infinite Values in Hierarchical Imperative Types.,Michael I. Schwartzbach   ,1990
91,journals/jiis/GainesS92,Integrated Knowledge Acquisition Architectures.,Brian R. Gaines   Mildred L. G. Shaw   ,1992
92,journals/jiis/Gaines97,Knowledge Management in Societies of Intelligent Adaptive Agents.,Brian R. Gaines   ,1997
93,conf/ogai/ThrunML90,Adaptive Look-Ahead Planning.,Sebastian Thrun   Knut M ouml,
94,conf/pldi/ReppyR96,Simple Objects for Standard ML.,John H. Reppy   Jon G. Riecke   ,1996
95,conf/zum/WinterS03,Compositional Verification for Object-Z.,Kirsten Winter   Graeme Smith   ,2003
96,journals/mst/Gallier80,On The Existence of Optimal Fixpoints.,Jean H. Gallier   ,1980
97,journals/mss/AnderliniS01,Cooperation and computability in n-player games.,Luca Anderlini   Hamid Sabourian   ,2001
98,conf/nips/LeungGPZ90,Phonetic Classification and Recognition Using the Multi-Layer Perceptron.,Hong C. Leung   James R. Glass   Michael S. Phillips   Victor Zue   ,1990
99,conf/se/BucklEMS10,Teaching Enterprise Architecture Management with Student Mini-Projects.,Sabine Buckl   Alexander M. Ernst   Florian Matthes   Christian M. Schweda   ,2010
100,conf/si3d/HsiungTW90,T-buffer fast visualization of relativistic effects in space-time.,Ping-Kang Hsiung   Robert H. Thibadeau   Michael Wu   ,1990
101,journals/sigops/KasshoekRST92,FLIP an Internetwork Protocol for Supporting Distributed Systems (Abstract).,M. Frans Kaashoek   Robbert van Renesse   Hans van Staveren   Andrew S. Tanenbaum   ,1992
102,conf/iv/LanzenbergerMP03,The Stardinates - Visualizing Highly Structured Data.,Monika Lanzenberger   Silvia Miksch   Margit Pohl   ,2003
103,journals/debu/Moss86,Getting the Operating System Out of the Way.,J. Eliot B. Moss   ,1986
104,conf/concur/GuptaJS96,Models for Concurrent Constraint Programming.,Vineet Gupta   Radha Jagadeesan   Vijay A. Saraswat   ,1996
105,journals/ci/BeekC90,Exact and approximate reasoning about temporal relations.,Peter van Beek   Robin Cohen   ,1990
106,conf/acl/Abeille90,Lexical and Syntactic Rules in a Tree Adjoining Grammar.,Anne Abeill eacute,
107,journals/corr/cmp-lg-9704010,The Theoretical Status of Ontologies in Natural Language Processing,John A. Bateman   ,1997
108,conf/cbms/Knight90,Issues of software reliability in medical systems.,John C. Knight   ,1990
109,conf/srds/Melliar-SmithM04,Progress in Real-Time Fault Tolerance.,P. M. Melliar-Smith   Louise E. Moser   ,2004
110,conf/ftcs/MoserMA95,The Totem System.,Louise E. Moser   P. M. Melliar-Smith   Deborah A. Agarwal   ,1995
111,conf/acm/MoiinMM93,Better Late Than Never.,Hossein Moiin   P. M. Melliar-Smith   Louise E. Moser   ,1993
112,conf/IEEEares/MoserMZ06,Making Web Services Dependable.,Louise E. Moser   P. M. Melliar-Smith   Wenbing Zhao   ,2006
113,conf/sde/Snodgrass84,Monitoring in a Software Development Environment A Relational Approach.,Richard T. Snodgrass   ,1984
114,conf/tark/BurrowsAN88,Authentication A Practical Study in Belief and Action.,Michael Burrows   Mart iacute,
115,conf/crypto/ZhengMI90,Structural Properties of One-way Hash Functions.,Yuliang Zheng   Tsutomu Matsumoto   Hideki Imai   ,1990
116,conf/nips/KimMB05,Robust Fisher Discriminant Analysis.,Seung-Jean Kim   Alessandro Magnani   Stephen P. Boyd   ,2005
117,conf/tark/BurrowsAN88,Authentication A Practical Study in Belief and Action.,Michael Burrows   Mart iacute,
118,conf/fqas/ChristiansenA96,An Experimental Prototype for Flexible Query-Answering Mechanisms - A Metainterpretation Approach.,Henning Christiansen   Troels Andreasen   ,1996
119,conf/iccv/KrummS95,Texture Segmentation and Shape in the Same Image.,John Krumm   Steven A. Shafer   ,1995
120,conf/tke/Skuce93,A System for Managing Knowledge and Terminology for Technical Documentation.,Douglas R. Skuce   ,1993
121,conf/tark/BurrowsAN88,Authentication A Practical Study in Belief and Action.,Michael Burrows   Mart iacute,
122,journals/tcsv/RasheedSS05,On the use of computable features for film classification.,Zeeshan Rasheed   Yaser Sheikh   Mubarak Shah   ,2005
123,journals/ci/BeekCS93,From Plan Critiquing to Clarification Dialogue for Cooperative ResponseGeneration.,Peter van Beek   Robin Cohen   Ken Schmidt   ,1993
124,journals/speech/CohenL94,Preliminaries to a collaborative model of dialogue.,Philip R. Cohen   Hector J. Levesque   ,1994
125,conf/ijcai/Koza89,Hierarchical Genetic Algorithms Operating on Populations of Computer Programs.,John R. Koza   ,1989
126,conf/sigmod/PangCL94,Managing Memory for Real-Time Queries.,HweeHwa Pang   Michael J. Carey   Miron Livny   ,1994
127,conf/foga/SpearsJ90,An Analysis of Multi-Point Crossover.,William M. Spears   Kenneth A. De Jong   ,1990
128,conf/icde/CabibboPT06,DaWaII a Tool for the Integration of Autonomous Data Marts.,Luca Cabibbo   Ivan Panella   Riccardo Torlone   ,2006
129,conf/cpe/BauseBK98,A Toolbox for Functional and Quantitative Analysis of DEDS.,Falko Bause   Peter Buchholz   Peter Kemper   ,1998
130,conf/ewdw/MatthesS90,Towards Database Application Systems Types Kinds and Other Open Invitations.,Florian Matthes   Joachim W. Schmidt   ,1990
131,journals/cj/Rijsbergen86,A Non-Classical Logic for Information Retrieval.,C. J. van Rijsbergen   ,1986
132,journals/corr/abs-0712-0131,Learning Similarity for Character Recognition and 3D Object Recognition,Thomas M. Breuel   ,2007
133,conf/icnc/BaiCY05,An Immune Partheno-Genetic Algorithm for Winner Determination in Combinatorial Auctions.,JianCong Bai   HuiYou Chang   Yang Yi   ,2005
134,conf/cis/ChenCHL08,Hybrid Algorithm for Winner Determination Problem in Combinatorial Auctions.,Li Chen   Xiaoyun Chen   Shanli Hu   Yunguo Lin   ,2008
135,conf/isaac/KloksB92,Approximating Treewidth and Pathwidth of some Classes of Perfect Graphs.,Ton Kloks   Hans L. Bodlaender   ,1992
136,journals/pami/PrinceW90,Reconstructing Convex Sets from Support Line Measurements.,Jerry L. Prince   Alan S. Willsky   ,1990
137,journals/tip/PrinceW93,Hierarchical reconstruction using geometry and sinogram restoration.,Jerry L. Prince   Alan S. Willsky   ,1993
138,journals/cvgip/PrinceW91,Convex set reconstruction using prior shape information.,Jerry L. Prince   Alan S. Willsky   ,1991
139,journals/tkde/RaoAV00,The Cost of Recovery in Message Logging Protocols.,Sriram Rao   Lorenzo Alvisi   Harrick M. Vin   ,2000
140,journals/fmsd/Russinoff99,A Mechanically Checked Proof of Correctness of the AMD K5 Floating Point Square Root Microcode.,David M. Russinoff   ,1999
141,conf/icnp/ChenMM96,Flow Control Techniques for Multicasting in Gigabit Networks.,Xiaomin Chen   Louise E. Moser   P. M. Melliar-Smith   ,1996
142,conf/icccn/ThomopoulosMM97,Analyzing the latency of the Totem multicast protocols.,Efstratios Thomopoulos   Louise E. Moser   P. M. Melliar-Smith   ,1997
143,conf/words/NarasimhanMM01,Strong Replica Consistency for Fault-Tolerant CORBA Applications.,Priya Narasimhan   Louise E. Moser   P. M. Melliar-Smith   ,2001
144,conf/icws/ZhaoMM05,A Reservation-Based Coordination Protocol for Web Services.,Wenbing Zhao   Louise E. Moser   P. M. Melliar-Smith   ,2005
145,conf/coots/NarasimhanMM97a,The Interception Approach to Reliable Distributed CORBA Objects.,Priya Narasimhan   Louise E. Moser   P. M. Melliar-Smith   ,1997
146,conf/icml/KimMB06,Optimal kernel selection in Kernel Fisher discriminant analysis.,Seung-Jean Kim   Alessandro Magnani   Stephen P. Boyd   ,2006
147,conf/tke/SkuceM90,Computer-Assisted Concept Analysis An Essential Component of a Terminologist's Workstation.,Douglas R. Skuce   Ingrid Meyer   ,1990
148,conf/acl/McCoyVY92,A Functional Approach to Generation with TAG.,Kathleen F. McCoy   K. Vijay-Shanker   Gijoo Yang   ,1992
149,conf/deductive/SudarshanR92,Optimizations of Bottom-Up Evaluation with Non-Ground Terms (Extended Abstract).,S. Sudarshan   Raghu Ramakrishnan   ,1992
150,conf/icde/DatTI05,A speech enhancement system based on data clustering and cumulative histogram equalization.,Tran Huy Dat   Kazuya Takeda   Fumitada Itakura   ,2005
151,conf/interspeech/SaruwatariKTIS00,Blind source separation based on subband ICA and beamforming.,Hiroshi Saruwatari   Satoshi Kurita   Kazuya Takeda   Fumitada Itakura   Kiyohiro Shikano   ,2000
152,conf/interspeech/LiTID04,Speech enhancement based on magnitude estimation using the gamma prior.,Weifeng Li   Kazuya Takeda   Fumitada Itakura   Tran Huy Dat   ,2004
153,conf/soups/BesmerWL10,The impact of social navigation on privacy policy configuration.,Andrew Besmer   Jason Watson   Heather Richter Lipford   ,2010
154,journals/tcad/ChanS89,Bounds on signal delay in RC mesh networks.,Pak K. Chan   Martine D. F. Schlag   ,1989
155,journals/corr/abs-1109-5559,High performance cosmological simulations on a grid of supercomputers,Derek Groen   Steven Rieder   Simon Portegies Zwart   ,2011
156,journals/toplas/WiledenCW90,A Comparative Evaluation of Object Definition Techniques.,Jack C. Wileden   Lori A. Clarke   Alexander L. Wolf   ,1990
157,journals/sigmod/HiddersMPV05,LiXQuery a formal foundation for XQuery research.,Jan Hidders   Philippe Michiels   Jan Paredaens   Roel Vercammen   ,2005
158,conf/xsym/HiddersPVD04,A Light but Formal Introduction to XQuery.,Jan Hidders   Jan Paredaens   Roel Vercammen   Serge Demeyer   ,2004
159,conf/eccv/BarSK04,Variational Pairing of Image Segmentation and Blind Restoration.,Leah Bar   Nir A. Sochen   Nahum Kiryati   ,2004
160,conf/icsm/OlbrichCS10,Are all code smells harmful? A study of God Classes and Brain Classes in the evolution of three open source systems.,Steffen M. Olbrich   Daniela Cruzes   Dag I. K. Sj oslash,
161,conf/sccc/Melliar-SmithM09,O-Ring A Fault Tolerance and Load Balancing Architecture for Peer-to-Peer Systems.,P. M. Melliar-Smith   Louise E. Moser   ,2009
162,conf/icse/DillonKMMR92,Graphical Specifications for Concurrent Software Systems.,Laura K. Dillon   G. Kutty   Louise E. Moser   P. M. Melliar-Smith   Y. S. Ramakrishna   ,1992
163,journals/adcm/ArnoldL97,Interior estimates for a low order finite element method for the Reissner-Mindlin plate model.,Douglas N. Arnold   Xiaobo Liu   ,1997
164,journals/jsac/DoucetteG00,Influence of modularity and economy-of-scale effects on design of mesh-restorable DWDM networks.,John Doucette   Wayne D. Grover   ,2000
165,journals/siamnum/KayaR05,A Discontinuous Subgrid Eddy Viscosity Method for the Time-Dependent Navier-Stokes Equations.,Songul Kaya   B eacute,
166,conf/ppsn/JongS90,An Analysis of the Interacting Roles of Population Size and Crossover in Genetic Algorithms.,Kenneth A. De Jong   William M. Spears   ,1990
167,conf/ismis/CamposLM88,Logical Connectives for Combining Fuzzy Measures.,Luis M. de Campos   Maria Teresa Lamata   Seraf iacute,
168,journals/cga/SlaterKMY09,Visual Realism Enhances Realistic Response in an Immersive Virtual Environment.,Mel Slater   Pankaj Khanna   Jesper Mortensen   Insu Yu   ,2009
169,journals/jpdc/AttiyaD01,Time Bounds for Decision Problems in the Presence of Timing Uncertainty and Failures.,Hagit Attiya   Taly Djerassi-Shintel   ,2001
170,conf/wdag/AttiyaD93,Time Bounds for Decision Problems in the Presence of Timing Uncertainty and Failures.,Hagit Attiya   Taly Djerassi-Shintel   ,1993
171,journals/jacm/Spielberg61,Representation of Power Series in Terms of Polynomials Rational Approximations and Continued Fractions.,Peter G. Harrison   Naresh M. Patel   Kurt Spielberg   ,1961
172,conf/vrst/KhannaYMS06,Presence in response to dynamic visual realism a preliminary report of an experiment study.,Pankaj Khanna   Insu Yu   Jesper Mortensen   Mel Slater   ,2006
173,journals/tocs/KaashoekRST93,FLIP An Internetwork Protocol for Supporting Distributed Systems.,M. Frans Kaashoek   Robbert van Renesse   Hans van Staveren   Andrew S. Tanenbaum   ,1993
174,conf/icdcs/RenesseTSH87,Connecting RPC-Based Distributed Systems Using Wide-Area Networks.,Robbert van Renesse   Andrew S. Tanenbaum   Hans van Staveren   J. Hall   ,1987
175,conf/isca/LenoskiLGGH90,The Directory-Based Cache Coherence Protocol for the DASH Multiprocessor.,Daniel Lenoski   James Laudon   Kourosh Gharachorloo   Anoop Gupta   John L. Hennessy   ,1990
176,journals/tsp/ChenNC95,Symmetric extension methods for M-channel linear-phase perfect-reconstruction filter banks.,Li Chen   Truong Q. Nguyen   Kwok Ping Chan   ,1995
177,conf/iceis/KaiyaSOK06,A Supporting Tool to Identify both Satisfied Requirements and Tolerant Threats for a Java Mobile Code Application.,Haruhiko Kaiya   Kouta Sasaki   Chikanobu Ogawa   Kenji Kaijiri   ,2006
178,journals/ipm/BooksteinK90,Using bitmaps for medium sized information retrieval systems.,Abraham Bookstein   Shmuel T. Klein   ,1990
179,journals/sigmod/Han98,Towards On-Line Analytical Mining in Large Databases.,Jiawei Han   ,1998
180,conf/podc/DworkLS84,Consensus in the Presence of Partial Synchrony (Preliminary Version).,Cynthia Dwork   Nancy A. Lynch   Larry J. Stockmeyer   ,1984
181,conf/ftcs/BrilliantKA90,On the performance of software testing using multiple versions.,Susan S. Brilliant   John C. Knight   Paul Ammann   ,1990
182,journals/cj/KihlstromMM03,Byzantine Fault Detectors for Solving Consensus.,Kim Potter Kihlstrom   Louise E. Moser   P. M. Melliar-Smith   ,2003
183,conf/dais/TewksburyMM01,Live Upgrade Techniques for CORBA Applications.,L. A. Tewksbury   Louise E. Moser   P. M. Melliar-Smith   ,2001
184,conf/icpp/DasMM92,PAL A Language for Parallel Asynchronous Computation.,Amitabha Das   Louise E. Moser   P. M. Melliar-Smith   ,1992
185,conf/irregular/DasMM95,A Parallel Processing Paradigm for Irregular Applications.,Amitabha Das   Louise E. Moser   P. M. Melliar-Smith   ,1995
186,conf/sigmetrics/MoserKM90,Probabilistic Language Analysis of Weighted Voting Algorithms.,Louise E. Moser   Vikas Kapur   P. M. Melliar-Smith   ,1990
