725,journals/coling/BachenkoF90,A Computational Grammar of Discourse-Neutral Prosodic Phrasing in English.,Joan Bachenko   Eileen Fitzpatrick   ,1990
726,conf/dbpl/HiddersMPV05,On the Expressive Power of XQuery Fragments.,Jan Hidders   Stefania Marrara   Jan Paredaens   Roel Vercammen   ,2005
727,journals/ijcv/BarKS06,Image Deblurring in the Presence of Impulsive Noise.,Leah Bar   Nahum Kiryati   Nir A. Sochen   ,2006
728,conf/srds/VerissimoM90,Reliable Broadcast for Fault-Tolerance on Local Computer Networks.,Paulo Ver iacute,
729,conf/bnaic/BleysB05,Explaining universal colour categories through a constrained acquisition process.,Joris Bleys   Tony Belpaeme   ,2005
730,conf/podc/KorachKM85,A Modular Technique for the Design of Efficient Distributed Leader Finding Algorithms.,Ephraim Korach   Shay Kutten   Shlomo Moran   ,1985
731,conf/podc/KorachKM85,A Modular Technique for the Design of Efficient Distributed Leader Finding Algorithms.,Ephraim Korach   Shay Kutten   Shlomo Moran   ,1985
732,journals/cogsci/Elman90,Finding Structure in Time.,Jeffrey L. Elman   ,1990
733,conf/colt/MaassT90,On the Complexity of Learning from Counterexamples and Membership Queries (abstract).,Wolfgang Maass   Gy ouml,
734,conf/nips/Fahlman90,The Recurrent Cascade-Correlation Architecture.,Scott E. Fahlman   ,1990
735,conf/ics/GallivanSZ90,Solving general sparse linear systems using conjugate gradient-type methods.,Kyle Gallivan   Ahmed H. Sameh   Zahari Zlatev   ,1990
736,journals/tocs/BurrowsAN90,A Logic of Authentication.,Michael Burrows   Mart iacute,
737,journals/ml/Quinlan90,Learning Logical Definitions from Relations.,J. Ross Quinlan   ,1990
738,conf/apvis/BuchsbaumGV07,Directed graphs and rectangular layouts.,Adam L. Buchsbaum   Emden R. Gansner   Suresh Venkatasubramanian   ,2007
739,journals/tocs/BurrowsAN90,A Logic of Authentication.,Michael Burrows   Mart iacute,
740,conf/coling/Guez90,A Computational Model for Arguments Understanding.,St eacute,
741,journals/jal/JohnsonZ90,Recovery in Distributed Systems Using Optimistic Message Logging and Checkpointing.,David B. Johnson   Willy Zwaenepoel   ,1990
742,journals/tocs/BurrowsAN90,A Logic of Authentication.,Michael Burrows   Mart iacute,
743,conf/coling/WebberE90,Free Adjuncts In Natural Language Instructions.,Bonnie L. Webber   Barbara Di Eugenio   ,1990
744,conf/coling/BlacheM90,Bottom-Up Filtering a Parsing Strategy for GPSG.,Philippe Blache   Jean-Yves Morin   ,1990
745,journals/coling/Ramsay90,Disjunction without Tears.,Allan Ramsay   ,1990
746,conf/coling/KerpedjievN90,Intelligent Handling Of Weather Forecasts.,Stephan M. Kerpedjiev   Veska Noncheva   ,1990
747,conf/acl/DawarV89,A Three-Valued Interpretation of Negation in Feature Structure Descriptions.,Anuj Dawar   K. Vijay-Shanker   ,1989
748,conf/coling/Dorrepaal90,Discourse Anaphora.,Joke Dorrepaal   ,1990
749,conf/compgeom/ChenH90,Shortest Paths on a Polyhedron.,Jindong Chen   Yijie Han   ,1990
750,journals/jcss/KampRVZ11,Deterministic extractors for small-space sources.,Jesse Kamp   Anup Rao   Salil P. Vadhan   David Zuckerman   ,2011
751,conf/cade/BonacinaE07,T-Decision by Decomposition.,Maria Paola Bonacina   Mnacho Echenim   ,2007
752,conf/issac/KaltofenLW90,Modular Rational Sparse Multivariate Polynomial Interpolation.,Erich Kaltofen   Yagati N. Lakshman   J.-M. Wiley   ,1990
753,journals/tcs/Schwartzbach96,Static Correctness of Hierarchical Procedures.,Michael I. Schwartzbach   ,1996
754,journals/aei/X90,Editorial.,,1990
755,journals/csse/X90,Editorial.,,1990
756,journals/expert/X90m,Editorial.,,1990
757,conf/icdcs/ShrivastavaW90,Implementing Fault-Tolerant Distributed Applications.,Santosh K. Shrivastava   Stuart M. Wheater   ,1990
758,conf/swat/BergKNO90,Finding Shortest Paths in the Presence of Orthogonal Obstacles Using a Combined L1 and Link Metric.,Mark de Berg   Marc J. van Kreveld   Bengt J. Nilsson   Mark H. Overmars   ,1990
759,journals/ai/Freksa92,Temporal Reasoning Based on Semi-Intervals.,Christian Freksa   ,1992
760,journals/tsp/Chornoboy92,Initialization for improved IIR filter performance.,Edward S. Chornoboy   ,1992
761,conf/focs/AndoniIP06,On the Optimality of the Dimensionality Reduction Method.,Bernard W. Lovell   Alexandr Andoni   Piotr Indyk   Mihai Patrascu   ,2006
762,journals/computer/MullenderRTRS90,Amoeba A Distributed Operating System for the 1990s.,Sape J. Mullender   Guido van Rossum   Andrew S. Tanenbaum   Robbert van Renesse   Hans van Staveren   ,1990
763,journals/ipl/AnderssonC90,Construction of a Tree From its Traversals in Optimal Time and Space.,Arne Andersson   Svante Carlsson   ,1990
764,journals/siamcomp/BeameBRRT99,A Time-Space Tradeoff for Undirected Graph Traversal by Walking Automata.,Paul Beame   Allan Borodin   Prabhakar Raghavan   Walter L. Ruzzo   Martin Tompa   ,1999
765,conf/acl/ShieberNMP89,A Semantic-Head-Driven Generation Algorithm for Unification-Based Formalisms.,Stuart M. Shieber   Gertjan van Noord   Robert C. Moore   Fernando C. N. Pereira   ,1989
766,conf/sigcomm/RamakrishnanJ88,A binary feedback scheme for congestion avoidance in computer networks with a connectionless network layer.,K. K. Ramakrishnan   Raj Jain   ,1988
767,conf/sigcomm/RamakrishnanJ88,A binary feedback scheme for congestion avoidance in computer networks with a connectionless network layer.,K. K. Ramakrishnan   Raj Jain   ,1988
768,conf/performance/HarrisonP87,The Representation of Switching Networks in Queueing Models of Parallel Systems.,Peter G. Harrison   Naresh M. Patel   ,1987
769,conf/sigcomm/RamakrishnanJ88,A binary feedback scheme for congestion avoidance in computer networks with a connectionless network layer.,K. K. Ramakrishnan   Raj Jain   ,1988
770,journals/sigplan/Bal90,Orca a language for distributed programming.,Henri E. Bal   Andrew S. Tanenbaum   M. Frans Kaashoek   ,1990
771,conf/stoc/AlonST90,A Separator Theorem for Graphs with an Excluded Minor and its Applications,,1990
772,conf/icwe/KnappKZ04,Modeling the Structure of Web Applications with ArgoUWE.,Alexander Knapp   Nora Koch   Gefei Zhang   ,2004
773,conf/icdcs/SchwarzBB90,Low-Cost Comparisons of File Copies.,Thomas J. E. Schwarz   Robert W. Bowdidgem   Walter A. Burkhard   ,1990
774,journals/jacm/HarrisonP90,The Representation of Multistage Interconnection Networks in Queuing Models of Parallel Systems,,1990
775,conf/micro/BeatyWJ90,Motivation and framework for using genetic algorithms for microcode compaction.,Steven J. Beaty   Darrell Whitley   Gearold Johnson   ,1990
776,conf/podc/HerlihyT90,Lower Bounds for Wait-Free Computation in Message-Passing Systems.,Maurice Herlihy   Mark R. Tuttle   ,1990
777,journals/comgeo/HershbergerS94,Computing Minimum Length Paths of a Given Homotopy Class.,John Hershberger   Jack Snoeyink   ,1994
778,conf/riao/BrownCPPJMR88,A Statistical Approach to French/English Translation.,Peter F. Brown   John Cocke   Stephen Della Pietra   Vincent J. Della Pietra   Frederick Jelinek   Robert L. Mercer   Paul S. Roossin   ,1988
779,journals/cacm/Meyer90,Lessons from the Design of the Eiffel Libraries.,Bertrand Meyer   ,1990
780,journals/siamam/BlochWH04,Radiation Induced Instability.,Anthony M. Bloch   Michael I. Weinstein   Patrick Hagerty   ,2004
781,conf/cade/KaminskiS08,Terminating Tableaux for Hybrid Logic with the Difference Modality and Converse.,Mark Kaminski   Gert Smolka   ,2008
782,journals/ras/Bicchi92,A criterion for optimal design of multi-axis force sensors.,Antonio Bicchi   ,1992
783,journals/dam/Stanley91,Some applications of algebra to combinatorics.,Richard P. Stanley   ,1991
784,conf/focs/HastadG90,On the Power of Small-Depth Threshold Circuits,,1990
785,conf/siggraph/PanneFV90,Reusable motion synthesis using state-space controllers.,Michiel van de Panne   Eugene Fiume   Zvonko G. Vranesic   ,1990
786,conf/naacl/MohammadDEHMQRZ09,Using Citations to Generate surveys of Scientific Paradigms.,Saif Mohammad   Bonnie J. Dorr   Melissa Egan   Ahmed Hassan   Pradeep Muthukrishnan   Vahed Qazvinian   Dragomir R. Radev   David M. Zajic   ,2009
787,conf/nips/KolenP90,Back Propagation is Sensitive to Initial Conditions.,John F. Kolen   Jordan B. Pollack   ,1990
788,conf/coling/ShieberS90,Synchronous Tree-Adjoining Grammars.,Stuart M. Shieber   Yves Schabes   ,1990
789,conf/acl/WalkerW90,Mixed Initiative in Dialogue An Investigation into Discourse Segmentation.,Marilyn A. Walker   Steve Whittaker   ,1990
790,journals/sigops/LadinLS91,Lazy Replication Exploiting the Semantics of Distributed Services (Extended Abstract).,Rivka Ladin   Barbara Liskov   Liuba Shrira   ,1991
791,journals/sigops/LadinLS91,Lazy Replication Exploiting the Semantics of Distributed Services (Extended Abstract).,Rivka Ladin   Barbara Liskov   Liuba Shrira   ,1991
792,conf/coling/BrownCPPJMR88,A statistical approach to language translation.,Peter F. Brown   John Cocke   Stephen Della Pietra   Vincent J. Della Pietra   Frederick Jelinek   Robert L. Mercer   Paul S. Roossin   ,1988
793,conf/vldb/SeltzerS90,Transaction Support in Read Optimizied and Write Optimized File Systems.,Margo I. Seltzer   Michael Stonebraker   ,1990
794,conf/coling/Lewin90,A Quantifier Scoping Algorithm without A Free Variable Constraint.,Ian Lewin   ,1990
795,conf/ntii/WickRMD08,A Discriminative Approach to Ontology Mapping.,Michael L. Wick   Khashayar Rohanimanesh   Andrew McCallum   AnHai Doan   ,2008
796,journals/mp/Rockafellar90,Computational Schemes for Large-Scale Problems in Extended Linear-Quadratic Programming.,R. Tyrrell Rockafellar   ,1990
797,conf/hotos/AndersenBKM01,The Case for Resilient Overlay Networks.,David G. Andersen   Hari Balakrishnan   M. Frans Kaashoek   Robert Morris   ,2001
798,conf/eacl/Fernando99,Ambiguous propositions typed.,Tim Fernando   ,1999
799,journals/jcss/FeketeLMW90,Commutativity-Based Locking for Nested Transactions.,Alan Fekete   Nancy A. Lynch   Michael Merritt   William E. Weihl   ,1990
800,conf/cvpr/SheikhS05,Bayesian Object Detection in Dynamic Scenes.,Yaser Sheikh   Mubarak Shah   ,2005
801,conf/coling/Konig90,The Complexity Of Parsing With Extended Categorial Grammars.,Esther K ouml,
802,conf/coling/Maruyama90,An Interactive Japanese Parser for Machine Translation.,Hiroshi Maruyama   ,1990
803,conf/mva/LiKI90,A Pattern Classifier Integrating Multilayer Perceptron and Error-Correcting Code.,Haibo Li   Torbj ouml,
804,conf/para/GwaltneyS04,Reliable Computation of Equilibrium States and Bifurcations in Nonlinear Dynamics.,C. Ryan Gwaltney   Mark A. Stadtherr   ,2004
805,journals/jsc/DershowitzR93,Deductive and Inductive Synthesis of Equational Programs.,Nachum Dershowitz   Uday S. Reddy   ,1993
806,journals/siamcomp/Beigel90,Unbounded Searching Slgorithms.,Richard Beigel   ,1990
807,conf/vldb/Sheth91,Federated Database Systems for Managing Distributed Heterogeneous and Autonomous Databases.,Amit P. Sheth   ,1991
808,journals/coling/PalmerF90,Workshop on the Evaluation of Natural Language Processing Systems.,Martha Stone Palmer   Timothy W. Finin   ,1990
809,conf/coco/AmirBG90,Some Connections Between Bounded Query Classes and Non-Uniform Complexity.,Amihood Amir   Richard Beigel   William I. Gasarch   ,1990
810,conf/fjcc/JacobF86,Software Engineering for Rule-Based Software Systems.,Robert J. K. Jacob   Judith N. Froscher   ,1986
811,conf/coling/NumazakiT90,A New Parallel Algorithm for Generalized LR Parsing.,Hiroaki Numazaki   Hozumi Tanaka   ,1990
812,conf/see/WiledenW89,Environment Object Management Technology Experiences Opportunities and Risks.,Jack C. Wileden   Alexander L. Wolf   ,1989
813,journals/bit/KreveldOA92,Intersection Queries in Sets of Disks.,Marc J. van Kreveld   Mark H. Overmars   Pankaj K. Agarwal   ,1992
814,conf/pos/KochSDVMFB90,Cache Coherency and Storage Management in a Persistent Object System.,Bett Koch   Tracy Schunke   Alan Dearle   Francis Vaughan   Chris D. Marlin   Ruth Fazakerley   Chris J. Barter   ,1990
815,journals/pami/RankaS90,Convolution on Mesh Connected Multicomputers.,Sanjay Ranka   Sartaj Sahni   ,1990
816,journals/toplas/KorachKM90,A Modular Technique for the Design of Efficient Distributed Leader Finding Algorithms.,Ephraim Korach   Shay Kutten   Shlomo Moran   ,1990
817,journals/jsyml/Lambalgen90,The Axiomatization of Randomness.,Michiel van Lambalgen   ,1990
818,conf/sigopsE/StephensonB90,Fast causal multicast.,Pat Stephenson   Kenneth P. Birman   ,1990
819,journals/toplas/KorachKM90,A Modular Technique for the Design of Efficient Distributed Leader Finding Algorithms.,Ephraim Korach   Shay Kutten   Shlomo Moran   ,1990
820,conf/acl/Gibson90,Memory Capacity and Sentence Processing.,Edward Gibson   ,1990
821,conf/ipmi/ChungRE05,Unified Statistical Approach to Cortical Thickness Analysis.,Moo K. Chung   Steve Robbins   Alan C. Evans   ,2005
822,conf/mva/TakayaMSKM90,Application of Image Reconstruction by Means of Chirp z-Transform.,Kunio Takaya   Tie-nan Ma   Koichi Shimizu   Masataka Kitama   Tomohisa Mikami   ,1990
823,journals/questa/GoldT93,Performance analysis of a batch service queue arising out of manufacturing system modelling.,Hermann Gold   Phuoc Tran-Gia   ,1993
824,journals/spe/DershowitzR90,Calendrical Calculations.,Nachum Dershowitz   Edward M. Reingold   ,1990
825,journals/tc/ChaudhuriHHSRH03,Latency Occupancy and Bandwidth in DSM Multiprocessors A Performance Evaluation.,Mainak Chaudhuri   Mark Heinrich   Chris Holt   Jaswinder Pal Singh   Edward Rothberg   John L. Hennessy   ,2003
826,conf/wstst/ZhouSSC08,Anisotropic mean shift based fuzzy c-means segmentation of skin lesions.,Huiyu Zhou   Gerald Schaefer   Abdul H. Sadka   M. Emre Celebi   ,2008
827,conf/podc/NeigerT88,Automatically Increasing the Fault-Tolerance of Distributed Systems.,Gil Neiger   Sam Toueg   ,1988
828,conf/ecir/JagarlamudiD10,Extracting Multilingual Topics from Unaligned Comparable Corpora.,Jagadeesh Jagarlamudi   Hal Daum eacute,
829,journals/ccr/AndersenBKM02,Resilient overlay networks.,David G. Andersen   Hari Balakrishnan   M. Frans Kaashoek   Robert Morris   ,2002
830,conf/fmldo/Wieringa90,Integrated Specification of Values Objects and Processes for Object-Oriented Models (Extended Abstract).,Roel Wieringa   ,1990
831,conf/aied/WalkerMRK07,Who Says Three's a Crowd? Using a Cognitive Tutor to Support Peer Tutoring.,Erin Walker   Bruce M. McLaren   Nikol Rummel   Kenneth R. Koedinger   ,2007
832,conf/swat/AnderssonL90,Fast Updating of Well-Balanced Trees.,Arne Andersson   Tony W. Lai   ,1990
833,journals/siamcomp/GoldmanKS93,Exact Identification of Read-Once Formulas Using Fixed Points of Amplification Functions.,Sally A. Goldman   Michael J. Kearns   Robert E. Schapire   ,1993
834,journals/software/Hall90,Seven Myths of Formal Methods.,Anthony Hall   ,1990
835,conf/acl/HobbsSME88,Interpretation as Abduction.,Jerry R. Hobbs   Mark E. Stickel   Paul A. Martin   Douglas Edwards   ,1988
836,conf/coling/SadlerV90,Pilot Implementation Of A Bilingual Knowledge Bank.,Victor Sadler   Ronald Vendelmans   ,1990
837,conf/acl/BobrowRW90,Multiple Underlying Systems Translating User Requests into Programs to Produce Answers.,Robert J. Bobrow   Philip Resnik   Ralph M. Weischedel   ,1990
838,conf/coling/BlockH90,Generating Referring Expressions Using Multiple Knowledge Sources.,Russell Block   Helmut Horacek   ,1990
839,conf/coling/SchutzeR90,Language Without A Central Pushdown Stack.,Carson T. Sch uuml,
840,conf/coling/Karlsson90,Constraint Grammar As A Framework For Parsing Running Text.,Fred Karlsson   ,1990
841,conf/ppsc/SharmaW91,Generating Finite Element Programs for Shared Memory Machines.,Naveen Sharma   Paul S. Wang   ,1991
842,journals/tse/Smith90,KIDS A Semiautomatic Program Development System.,Douglas R. Smith   ,1990
843,journals/dcg/AvisF92,A Pivoting Algorithm for Convex Hulls and Vertex Enumeration of Arrangements and Polyhedra.,David Avis   Komei Fukuda   ,1992
844,conf/compgeom/AvisF91,A Pivoting Algorithm for Convex Hulls and Vertex Enumeration of Arrangements and Polyhedra.,David Avis   Komei Fukuda   ,1991
845,journals/dcg/AvisF92,A Pivoting Algorithm for Convex Hulls and Vertex Enumeration of Arrangements and Polyhedra.,David Avis   Komei Fukuda   ,1992
846,conf/compgeom/AvisF91,A Pivoting Algorithm for Convex Hulls and Vertex Enumeration of Arrangements and Polyhedra.,David Avis   Komei Fukuda   ,1991
847,conf/infocom/GreavesLH90,The Cambridge Backbone Ring.,David J. Greaves   Dimitris Lioupis   Andy Hopper   ,1990
848,journals/jacm/McAllester93,Automatic Recognition of Tractability in Inference Relations.,David A. McAllester   ,1993
849,conf/scalespace/BarSK05,Image Deblurring in the Presence of Salt-and-Pepper Noise.,Leah Bar   Nir A. Sochen   Nahum Kiryati   ,2005
850,journals/sigart/CarbonellEGJKMV91,PRODIGY An Integrated Architecture for Planning and Learning.,Jaime G. Carbonell   Oren Etzioni   Yolanda Gil   Robert Joseph   Craig A. Knoblock   Steven Minton   Manuela M. Veloso   ,1991
851,conf/swat/BodlaenderM90,The Pathwidth and Treewidth of Cographs.,Hans L. Bodlaender   Rolf H. M ouml,
852,journals/jet/CrippsDP05,Reputation with equal discounting in repeated games with strictly conflicting interests.,Martin W. Cripps   Eddie Dekel   Wolfgang Pesendorfer   ,2005
853,conf/sosp/SchroederB89,Performance of Firefly RPC.,Michael D. Schroeder   Michael Burrows   ,1989
854,conf/icdcs/ThomasianR90,A New Distributed Optimistic Concurrency Control Method and a Comparison of its Performance with Two-Phase Locking.,Alexander Thomasian   Erhard Rahm   ,1990
855,journals/jcss/ChangCGHHRR94,The Random Oracle Hypothesis Is False.,Richard Chang   Benny Chor   Oded Goldreich   Juris Hartmanis   Johan H aring,
856,conf/wec/DuboisA05b,SVM-Based Detection of SAR Images in Partially Developed Speckle Noise.,Jean-Pierre Dubois   O. M. Abdul-Latif   ,2005
857,conf/coling/DymetmanIP90,A Symmetrical Approach to Parsing and Generation.,Marc Dymetman   Pierre Isabelle   Fran ccedil,
858,journals/anor/GroverD01,Topological Design of Survivable Mesh-Based Transport Networks.,Wayne D. Grover   John Doucette   ,2001
859,conf/mva/VaxiviereT90,Interpretation of Mechanical Engineering Drawings for Paper-CAD Conversion.,Pascal Vaxivi egrave,
860,conf/stoc/KampRVZ06,Deterministic extractors for small-space sources.,Jesse Kamp   Anup Rao   Salil P. Vadhan   David Zuckerman   ,2006
861,conf/isca/PapadopoulosC90,Monsoon An Explicit Token-Store Architecture.,Gregory M. Papadopoulos   David E. Culler   ,1990
862,journals/ndjfl/PelletierM90,Post's Functional Completeness Theorem.,Francis Jeffry Pelletier   Norman M. Martin   ,1990
863,journals/corr/abs-0803-1520,Integrity-Enhancing Replica Coordination for Byzantine Fault Tolerant Systems,Wenbing Zhao   ,2008
864,conf/sigcomm/BreslauE90,Design of Inter-Administrative Domain Routing Protocols.,Lee Breslau   Deborah Estrin   ,1990
865,conf/ppopp/Herlihy90,A Methodology for Implementing Highly Concurrent Data Structures.,Maurice Herlihy   ,1990
866,conf/ijcai/Sandholm99,An Algorithm for Optimal Winner Determination in Combinatorial Auctions.,Tuomas Sandholm   ,1999
867,conf/concur/FeketeL90,The Need for Headers An Impossibility Result for Communication over Unreliable Channels.,Alan Fekete   Nancy A. Lynch   ,1990
868,conf/coling/KernighanCG90,A Spelling Correction Program Based on a Noisy Channel Model.,Mark D. Kernighan   Kenneth Ward Church   William A. Gale   ,1990
869,conf/emnets/WoehrlePBT07,Increasing the reliability of wireless sensor networks with a distributed testing framework.,Matthias Woehrle   Christian Plessl   Jan Beutel   Lothar Thiele   ,2007
870,conf/cscw/BeardPHBNS90,A Visual Calendar for Scheduling Group Meetings.,David Beard   Murugappan Palaniappan   Alan Humm   David Banks   Anil Nair   Yen-Ping Shan   ,1990
871,conf/eurocrypt/ZhengMI89,Impossibility and Optimality Results on Constructing Pseudorandom Permutations (Extended Abstract).,Yuliang Zheng   Tsutomu Matsumoto   Hideki Imai   ,1989
872,conf/acl/Ingria90,The Limits of Unification.,Robert Ingria   ,1990
873,conf/iccv/BergenBHP90,Computing two motions from three frames.,James R. Bergen   Peter J. Burt   Rajesh Hingorani   Shrnuel Peleg   ,1990
874,conf/focs/Istrail90,Constructing Generalized Universal Traversing Sequences of Polynomial Size for Graphs with Small Diameter (Extended Abstract),,1990
875,journals/iandc/BeameBRRT96,Time-Space Tradeoffs for Undirected Graph Traversal by Graph Automata.,Paul Beame   Allan Borodin   Prabhakar Raghavan   Walter L. Ruzzo   Martin Tompa   ,1996
876,journals/ml/DietterichHB95,A Comparison of ID3 and Backpropagation for English Text-to-Speech Mapping.,Thomas G. Dietterich   Hermann Hild   Ghulum Bakiri   ,1995
877,journals/tjs/ShenO90,Systolic arrays for multidimensional discrete transforms.,Weicheng Shen   A. Yavuz Oru ccedil,
878,journals/siamcomp/CidonKMP95,Greedy Packet Scheduling.,Israel Cidon   Shay Kutten   Yishay Mansour   David Peleg   ,1995
879,conf/ijcai/BeekC91,Resolving Plan Ambiguity for Cooperative Response Generation.,Peter van Beek   Robin Cohen   ,1991
880,conf/isca/AdveH98,Retrospective Weak Ordering - A New Definition.,Sarita V. Adve   Mark D. Hill   ,1998
881,conf/alp/DershowitzMS90,Equation Solving in Conditional AC-Theories.,Nachum Dershowitz   Subrata Mitra   G. Sivakumar   ,1990
882,conf/iccad/MalavasiCS90,A Routing Methodology for Analog Integrated Circuits.,Enrico Malavasi   Umakanta Choudhury   Alberto L. Sangiovanni-Vincentelli   ,1990
883,conf/csb/LangmeadD04,High-Throughput 3D Structural Homology Detection via NMR Resonance Assignment.,Christopher James Langmead   Bruce Randall Donald   ,2004
884,journals/pami/SolinaB90,Recovery of Parametric Models from Range Images The Case for Superquadrics with Global Deformations.,Franc Solina   Ruzena Bajcsy   ,1990
885,conf/visualization/HsiungTCDWO90,Wide-band Relativistic Doppler Effect Visualization.,Ping-Kang Hsiung   Robert H. Thibadeau   Christopher B. Cox   Robert H. P. Dunn   Michael Wu   P. A. Olbrich   ,1990
886,journals/questa/NiuC91,A Suality Relation for Busy Cycles in GI/G/1 Queues.,Shun-Chen Niu   Robert B. Cooper   ,1991
887,journals/sigops/Bacon91,Transparent Recovery in Distributed Systems.,David F. Bacon   ,1991
888,journals/ml/Quinlan90,Learning Logical Definitions from Relations.,J. Ross Quinlan   ,1990
889,journals/tog/DynLG90,A butterfly subdivision scheme for surface interpolation with tension control.,Nira Dyn   David Levine   John A. Gregory   ,1990
890,conf/coling/NeumannF90,A Head-Driven Approach to Incremental and Parallel Generation of Syntactic Structures.,G uuml,
891,conf/coling/Deemter90,Structured Meanings in Computational Linguistics.,Kees van Deemter   ,1990
892,conf/coling/Sabah90,CARAMEL A flexible model for interaction between the cognitive processes underlying natural language understanding.,G eacute,
893,conf/ifipTCS/Schmidt-SchaussNSS08,Adequacy of Compositional Translations for Observational Semantics.,Manfred Schmidt-Schau szlig,
894,conf/pldi/AgrawalH90,Dynamic Program Slicing.,Hiralal Agrawal   Joseph Robert Horgan   ,1990
895,journals/cl/BalachandranDB90,Efficient Retargetable Code Generation Using Bottom-up Tree Pattern Matching.,A. Balachandran   Dhananjay M. Dhamdhere   S. Biswas   ,1990
896,conf/edmcc/Schmidt91,Making PEACE a Dynamic Alterable System.,Henning Schmidt   ,1991
897,conf/uai/Bacchus88,On probability distributions over possible worlds.,Fahiem Bacchus   ,1988
898,conf/edbt/TOC90,Table of Contents.,,1990
899,conf/edbt/TOC90,Table of Contents.,,1990
900,journals/csur/Schneider90,Implementing Fault-Tolerant Services Using the State Machine Approach A Tutorial.,Fred B. Schneider   ,1990
901,conf/oopsla/NierstraszP90,Viewing Objects as Patterns of Communicating Agents.,Oscar Nierstrasz   Michael Papathomas   ,1990
902,journals/tc/ShihWK90,Unifying Maximum Cut and Minimum Cut of a Planar Graph.,Wei Kuan Shih   Sun Wu   Yue-Sun Kuo   ,1990
903,conf/isca/SmithLH90,Boosting Beyond Static Scheduling in a Superscalar Processor.,Michael D. Smith   Monica S. Lam   Mark Horowitz   ,1990
904,journals/tit/CidonGK95,New models and algorithms for future networks.,Israel Cidon   Inder S. Gopal   Shay Kutten   ,1995
905,conf/podc/CidonGK88,New Models and Algorithms for Future Networks.,Israel Cidon   Inder S. Gopal   Shay Kutten   ,1988
906,conf/coling/AbeilleSJ90,Using Lexicalized Tags for Machine Translation.,Anne Abeill eacute,
907,conf/acl/LappinM90,A Syntactic Filter on Pronomial Anaphora for Slot Grammar.,Shalom Lappin   Michael C. McCord   ,1990
908,conf/sdm/ZhangWWZ08,Semi-Supervised Classification with Universum.,Dan Zhang   Jingdong Wang   Fei Wang 0001   Changshui Zhang   ,2008
909,conf/icde/StonebrakerS90,Distributed RAID - A New Multiple Copy Algorithm.,Michael Stonebraker   Gerhard A. Schloss   ,1990
910,conf/esop/Bertot90,Implementation of an Interpreter for a Parallel Language in Centaur.,Yves Bertot   ,1990
911,journals/computer/MinkCNR90,Multiprocessor Performance-Measurement Instrumentation.,Alan Mink   Robert J. Carpenter   George Nacht   John W. Roberts   ,1990
912,conf/coling/Thurmair90,Parsing for Grammar and Style Checking.,Gregor Thurmair   ,1990
913,conf/acl/Steedman90,Structure and Intonation in Spoken Language Undestanding.,Mark Steedman   ,1990
914,journals/cce/GwaltneySS04,Reliable computation of equilibrium states and bifurcations in food chain models.,C. Ryan Gwaltney   Mark P. Styczynski   Mark A. Stadtherr   ,2004
915,journals/jsc/BonacinaE10,Theory decision by decomposition.,Maria Paola Bonacina   Mnacho Echenim   ,2010
916,conf/sigmod/KemperM90,Access Support in Object Bases.,Alfons Kemper   Guido Moerkotte   ,1990
917,journals/coling/Harper92,Ambiguous Noun Phrases in Logical Form.,Mary P. Harper   ,1992
918,journals/jasis/DeerwesterDLFH90,Indexing by Latent Semantic Analysis.,Scott C. Deerwester   Susan T. Dumais   Thomas K. Landauer   George W. Furnas   Richard A. Harshman   ,1990
